{
  "$schema": "http://json-schema.org/draft-07/schema#",
  "title": "Tema kosakata",
  "type": "array",
  "minItems": 1,
  "items": {
    "type": "object",
    "additionalProperties": false,
    "required": ["id", "label", "icon", "description"],
    "properties": {
      "id": { "type": "string", "pattern": "^[a-z-]+$" },
      "label": { "type": "string", "minLength": 1 },
      "icon": { "type": "string", "pattern": "^bi-[a-z0-9-]+$" },
      "description": { "type": "string", "minLength": 1 }
    }
  }
}
