[
  { "id": "salam", "label": "Salam & ungkapan", "icon": "bi-chat-heart", "description": "Sapaan, terima kasih, dan ungkapan sehari-hari" },
  { "id": "angka", "label": "Angka", "icon": "bi-123", "description": "Bilangan, hitungan, dan uang" },
  { "id": "waktu", "label": "Waktu & hari", "icon": "bi-calendar3", "description": "Hari, bulan, jam, dan musim" },
  { "id": "keluarga", "label": "Keluarga", "icon": "bi-people", "description": "Anggota keluarga" },
  { "id": "orang-pekerjaan", "label": "Orang & pekerjaan", "icon": "bi-person-badge", "description": "Orang, kebangsaan, dan profesi" },
  { "id": "sekolah", "label": "Sekolah", "icon": "bi-backpack", "description": "Kelas, alat tulis, dan pelajaran" },
  { "id": "makanan-minuman", "label": "Makanan & minuman", "icon": "bi-cup-hot", "description": "Makanan, minuman, dan waktu makan" },
  { "id": "tempat", "label": "Tempat", "icon": "bi-geo-alt", "description": "Tempat umum, rumah, dan arah" },
  { "id": "kata-kerja", "label": "Kata kerja dasar", "icon": "bi-lightning", "description": "Kata kerja yang paling sering dipakai" },
  { "id": "kata-sifat", "label": "Kata sifat dasar", "icon": "bi-brush", "description": "Kata sifat i dan na yang umum" }
]
